key,en,current_hi,final_hi,verdict,note
home.title,XSWU,XSWU,XSWU,Approved,Brand string; identical across locales.
home.trustBanner,No ads. No accounts. No tracking.,कोई विज्ञापन नहीं। कोई खाता नहीं। कोई ट्रैकिंग नहीं।,कोई विज्ञापन नहीं। कोई खाता नहीं। कोई ट्रैकिंग नहीं।,Approved,Three short clauses parallel the English; ट्रैकिंग is an established loanword in modern Hindi privacy notices.
home.languageLabel,Language,भाषा,भाषा,Approved,Standard term; works for ages 4-9.
home.ageBandLabel,Age,उम्र,उम्र,Approved,Common everyday word for age.
home.modeLabel,Mode,मोड,मोड,Approved,Loanword widely understood in Hindi UI; alternative खेल is ambiguous between game and play.
home.playCta,Play,खेलें,खेलें,Approved,Polite imperative form; matches the Spanish polite imperative.
mode.shapeMemory,Shape Memory,आकृति स्मरण,आकृति याद,Revised,स्मरण is literary/formal; याद is the common everyday word for memory and is age-appropriate for 4-9.
mode.colorShape,Color & Shape,रंग और आकृति,रंग और आकृति,Approved,Direct one-to-one mapping; renders cleanly at 375 px in trial.
mode.math,Math Match,गणित जोड़,गणित मिलान,Revised,जोड़ means addition only; मिलान means match and aligns with English Math Match across all ages.
ageBand.4-5,4 to 5,4 से 5,4 से 5,Approved,Numbers + से (range word) is the natural Hindi form.
ageBand.6-7,6 to 7,6 से 7,6 से 7,Approved,Numbers + से (range word) is the natural Hindi form.
ageBand.8-9,8 to 9,8 से 9,8 से 9,Approved,Numbers + से (range word) is the natural Hindi form.
language.en,English,अंग्रेज़ी,अंग्रेज़ी,Approved,Standard endonym used in school and media.
language.hi,Hindi,हिन्दी,हिन्दी,Approved,Standard endonym; matches Devanagari conventions used in school texts.
language.es,Spanish,स्पैनिश,स्पैनिश,Approved,Loanword from English Spanish; widely understood and unambiguous.
prompt.colorShape,Find the {color} {shape},{color} {shape} ढूँढें,{color} {shape} ढूँढें,Approved,Polite imperative ढूँढें matches the home.playCta register.
prompt.math,What is {expression}?,{expression} कितना है?,{expression} कितना है?,Approved,Question form is natural and concise.
feedback.tryAgain,Try again,फिर कोशिश करें,फिर कोशिश करें,Approved,Encouraging polite imperative; not corrective.
feedback.greatJob,Great job!,शाबाश!,शाबाश!,Approved,Classic kid praise; widely used across Indian Hindi-speaking regions.
reward.title,Great job!,शाबाश!,शाबाश!,Approved,Mirrors feedback.greatJob for consistency.
reward.playAgain,Play again,फिर खेलें,फिर खेलें,Approved,Mirrors home.playCta with फिर (again) prefix.
reward.backHome,Back home,वापस होम,घर वापस,Revised,होम is a partial English loanword; घर वापस uses plain Hindi (घर = home) and is clearer for ages 4-9.
reward.chooseAnother,Choose another game,एक और खेल चुनें,एक और खेल चुनें,Approved,Reads naturally; एक और (one more / another) is age-appropriate.
a11y.languageSelected,{language} selected,{language} चुनी गई,{language} चुनी गई,Approved,Feminine gender agrees with भाषा (language).
a11y.ageBandSelected,Age {band} selected,उम्र {band} चुनी गई,उम्र {band} चुनी गई,Approved,Feminine gender agrees with उम्र (age).
a11y.modeSelected,{mode} selected,{mode} चुना गया,{mode} चुना गया,Approved,Masculine gender agrees with मोड (mode).
a11y.cardFaceDown,"Card, face down","कार्ड, उल्टा","कार्ड, उल्टा",Approved,Loanword कार्ड is widely used; उल्टा (upside-down) reads as face-down in card-game context.
a11y.cardRevealed,{shape} card,{shape} कार्ड,{shape} कार्ड,Approved,Postpositive structure is natural in Hindi.
a11y.skipToMain,Skip to main content,मुख्य सामग्री पर जाएँ,मुख्य सामग्री पर जाएँ,Approved,A11y register; मुख्य सामग्री is the standard accessibility term used by Hindi screen-reader localizations.
guide.openLink,How to play,कैसे खेलें,कैसे खेलें,Approved,Newly authored for the user guide; concise prompt-style phrasing reads naturally on the home link.
guide.title,How to play XSWU,XSWU कैसे खेलें,XSWU कैसे खेलें,Approved,Newly authored for the user guide; preserves XSWU brand at the front then applies the कैसे खेलें pattern.
guide.kidsHeading,For kids,बच्चों के लिए,बच्चों के लिए,Approved,Newly authored; standard child-friendly heading.
guide.kidsWelcome,"Welcome! Pick your language, your age, and a game. Tap to play.","स्वागत है! अपनी भाषा, उम्र और खेल चुनें। खेलने के लिए दबाएँ।","स्वागत है! अपनी भाषा, उम्र और खेल चुनें। खेलने के लिए दबाएँ।",Approved,Newly authored; uses simple imperative for young readers.
guide.kidsShapeMemory,"Shape Memory: tap two cards to flip them. If they match, they stay up. Find every pair to win.","आकृति याद: दो कार्ड दबाकर पलटें। अगर मेल खाएँ तो खुले रहेंगे। हर जोड़ी ढूँढें और जीतें।","आकृति याद: दो कार्ड दबाकर पलटें। अगर मेल खाएँ तो खुले रहेंगे। हर जोड़ी ढूँढें और जीतें।",Approved,Newly authored; मेल खाएँ is natural for matching pairs.
guide.kidsColorShape,"Color and Shape: read the prompt, then tap the matching picture. There is no clock.","रंग और आकृति: सवाल पढ़ें, फिर सही तस्वीर दबाएँ। कोई समय सीमा नहीं।","रंग और आकृति: सवाल पढ़ें, फिर सही तस्वीर दबाएँ। कोई समय सीमा नहीं।",Approved,Newly authored; समय सीमा conveys time limit clearly.
guide.kidsMath,"Math Match: read the question, then tap the right number. You can try again if you miss.","गणित मिलान: सवाल पढ़ें, फिर सही नंबर दबाएँ। गलत हो तो फिर कोशिश कर सकते हैं।","गणित मिलान: सवाल पढ़ें, फिर सही नंबर दबाएँ। गलत हो तो फिर कोशिश कर सकते हैं।",Approved,Newly authored; नंबर is widely understood loanword in school contexts.
guide.kidsHaveFun,There are no points and no timer. Take your time and have fun!,कोई अंक या घड़ी नहीं है। आराम से खेलें और मज़ा लें!,कोई अंक या घड़ी नहीं है। आराम से खेलें और मज़ा लें!,Approved,Newly authored; encouraging tone preserved.
guide.parentsHeading,For parents,अभिभावकों के लिए,अभिभावकों के लिए,Approved,Newly authored; अभिभावक is the standard formal term for parents/guardians.
guide.parentsPrivacy,"XSWU collects no personal information. There are no accounts, no ads, no third-party trackers, and no network calls outside this site.","XSWU कोई व्यक्तिगत जानकारी एकत्र नहीं करता। न खाते हैं, न विज्ञापन, न तीसरे पक्ष के ट्रैकर, और इस साइट के बाहर कोई नेटवर्क कॉल नहीं।","XSWU कोई व्यक्तिगत जानकारी एकत्र नहीं करता। न खाते हैं, न विज्ञापन, न तीसरे पक्ष के ट्रैकर, और इस साइट के बाहर कोई नेटवर्क कॉल नहीं।",Approved,Newly authored; technical loanwords retained for parent audience.
guide.parentsAgeBands,"Age bands tune difficulty: 4 to 5 is gentle (small grids, counting), 6 to 7 adds basic add and subtract, 8 to 9 covers numbers up to 20 with simple multiplication.","उम्र बैंड कठिनाई तय करते हैं: 4 से 5 आसान है (छोटे ग्रिड, गिनती), 6 से 7 में सरल जोड़-घटाव, 8 से 9 में 20 तक के नंबर और सरल गुणा।","उम्र बैंड कठिनाई तय करते हैं: 4 से 5 आसान है (छोटे ग्रिड, गिनती), 6 से 7 में सरल जोड़-घटाव, 8 से 9 में 20 तक के नंबर और सरल गुणा।",Approved,Newly authored; जोड़-घटाव is standard add-subtract phrase.
guide.parentsModes,"Three modes are available: Shape Memory builds visual recall, Color and Shape practices attribute matching, Math Match practices number recognition and arithmetic.","तीन मोड हैं: आकृति याद दृश्य स्मृति बढ़ाता है, रंग और आकृति विशेषता मिलान का अभ्यास है, गणित मिलान संख्या और अंकगणित का अभ्यास है।","तीन मोड हैं: आकृति याद दृश्य स्मृति बढ़ाता है, रंग और आकृति विशेषता मिलान का अभ्यास है, गणित मिलान संख्या और अंकगणित का अभ्यास है।",Approved,Newly authored; अंकगणित is the formal arithmetic term familiar to parents.
guide.parentsAccessibility,All controls are keyboard reachable. Animations respect the prefers-reduced-motion setting in your operating system or browser.,सभी नियंत्रण कीबोर्ड से पहुँच योग्य हैं। एनिमेशन आपके सिस्टम की prefers-reduced-motion सेटिंग का सम्मान करते हैं।,सभी नियंत्रण कीबोर्ड से पहुँच योग्य हैं। एनिमेशन आपके सिस्टम की prefers-reduced-motion सेटिंग का सम्मान करते हैं।,Approved,Newly authored; the CSS keyword prefers-reduced-motion is left in English by design (it is a literal API name).
guide.parentsLocalStorage,"Your language, age, and last-played mode are saved in your browser only. Clear your browser site data to reset them.","आपकी भाषा, उम्र और अंतिम मोड केवल आपके ब्राउज़र में सहेजे जाते हैं। रीसेट के लिए ब्राउज़र साइट डेटा साफ़ करें।","आपकी भाषा, उम्र और अंतिम मोड केवल आपके ब्राउज़र में सहेजे जाते हैं। रीसेट के लिए ब्राउज़र साइट डेटा साफ़ करें।",Approved,Newly authored; ब्राउज़र and साइट डेटा are common loanwords in tech contexts.
